{"id":"okonomi.bnp_lopende","title":"BNP, markedsverdi, løpende priser","unit":"mrd. kr","price_basis":"løpende","claim_level":"offisiell","source_ids":["ssb-09189"],"vintage":"2026-05-28","values":[{"period":"1990","value":747.06,"status":"regnskap"},{"period":"1991","value":785.399,"status":"regnskap"},{"period":"1992","value":807.878,"status":"regnskap"},{"period":"1993","value":850.169,"status":"regnskap"},{"period":"1994","value":891.547,"status":"regnskap"},{"period":"1995","value":957.145,"status":"regnskap"},{"period":"1996","value":1047.625,"status":"regnskap"},{"period":"1997","value":1131.84,"status":"regnskap"},{"period":"1998","value":1154.068,"status":"regnskap"},{"period":"1999","value":1258.047,"status":"regnskap"},{"period":"2000","value":1501.766,"status":"regnskap"},{"period":"2001","value":1560.878,"status":"regnskap"},{"period":"2002","value":1559.715,"status":"regnskap"},{"period":"2003","value":1622.73,"status":"regnskap"},{"period":"2004","value":1790.781,"status":"regnskap"},{"period":"2005","value":2006.306,"status":"regnskap"},{"period":"2006","value":2243.201,"status":"regnskap"},{"period":"2007","value":2390.482,"status":"regnskap"},{"period":"2008","value":2662.42,"status":"regnskap"},{"period":"2009","value":2488.057,"status":"regnskap"},{"period":"2010","value":2660.232,"status":"regnskap"},{"period":"2011","value":2874.427,"status":"regnskap"},{"period":"2012","value":3054.67,"status":"regnskap"},{"period":"2013","value":3173.277,"status":"regnskap"},{"period":"2014","value":3250.586,"status":"regnskap"},{"period":"2015","value":3231.063,"status":"regnskap"},{"period":"2016","value":3219.586,"status":"regnskap"},{"period":"2017","value":3438.31,"status":"regnskap"},{"period":"2018","value":3696.944,"status":"regnskap"},{"period":"2019","value":3733.355,"status":"regnskap"},{"period":"2020","value":3599.226,"status":"regnskap"},{"period":"2021","value":4480.477,"status":"regnskap"},{"period":"2022","value":5935.035,"status":"regnskap"},{"period":"2023","value":5304.881,"status":"regnskap"},{"period":"2024","value":5382.441,"status":"foreløpig"},{"period":"2025","value":5511.334,"status":"foreløpig"}]}
