{"id":"sysselsetting.ledige_aku_tusen","title":"Arbeidsledige 15–74 år, AKU","unit":"1000 personer","price_basis":"ikke-relevant","claim_level":"offisiell","source_ids":["ssb-13618"],"values":[{"period":"2015","value":131,"status":"regnskap"},{"period":"2016","value":137,"status":"regnskap"},{"period":"2017","value":122,"status":"regnskap"},{"period":"2018","value":113,"status":"regnskap"},{"period":"2019","value":111,"status":"regnskap"},{"period":"2020","value":136,"status":"regnskap"},{"period":"2021","value":128,"status":"regnskap"},{"period":"2022","value":96,"status":"regnskap"},{"period":"2023","value":107,"status":"regnskap"},{"period":"2024","value":121,"status":"regnskap"},{"period":"2025","value":136,"status":"regnskap"}]}
