{
  "id": "okonomi.bnp_fastland_per_innbygger_lopende",
  "title": "BNP Fastlands-Norge per innbygger, løpende priser",
  "unit": "kr per innbygger",
  "price_basis": "løpende",
  "claim_level": "utledet",
  "derivation": "BNP Fastlands-Norge (løpende priser, mill. kr) × 1 000 000 / gjennomsnitt av folkemengden 1. januar i året og 1. januar året etter (tilnærming til gjennomsnittsbefolkning)",
  "source_ids": [
    "ssb-09189",
    "ssb-06913"
  ],
  "vintage": "2026-05-28",
  "values": [
    {
      "period": "1990",
      "value": 150168,
      "status": "regnskap"
    },
    {
      "period": "1991",
      "value": 156117,
      "status": "regnskap"
    },
    {
      "period": "1992",
      "value": 161488,
      "status": "regnskap"
    },
    {
      "period": "1993",
      "value": 168324,
      "status": "regnskap"
    },
    {
      "period": "1994",
      "value": 176219,
      "status": "regnskap"
    },
    {
      "period": "1995",
      "value": 188718,
      "status": "regnskap"
    },
    {
      "period": "1996",
      "value": 198428,
      "status": "regnskap"
    },
    {
      "period": "1997",
      "value": 212720,
      "status": "regnskap"
    },
    {
      "period": "1998",
      "value": 228013,
      "status": "regnskap"
    },
    {
      "period": "1999",
      "value": 238925,
      "status": "regnskap"
    },
    {
      "period": "2000",
      "value": 252826,
      "status": "regnskap"
    },
    {
      "period": "2001",
      "value": 266466,
      "status": "regnskap"
    },
    {
      "period": "2002",
      "value": 275927,
      "status": "regnskap"
    },
    {
      "period": "2003",
      "value": 285770,
      "status": "regnskap"
    },
    {
      "period": "2004",
      "value": 306677,
      "status": "regnskap"
    },
    {
      "period": "2005",
      "value": 328961,
      "status": "regnskap"
    },
    {
      "period": "2006",
      "value": 359783,
      "status": "regnskap"
    },
    {
      "period": "2007",
      "value": 394102,
      "status": "regnskap"
    },
    {
      "period": "2008",
      "value": 415259,
      "status": "regnskap"
    },
    {
      "period": "2009",
      "value": 415464,
      "status": "regnskap"
    },
    {
      "period": "2010",
      "value": 434732,
      "status": "regnskap"
    },
    {
      "period": "2011",
      "value": 447468,
      "status": "regnskap"
    },
    {
      "period": "2012",
      "value": 469941,
      "status": "regnskap"
    },
    {
      "period": "2013",
      "value": 490769,
      "status": "regnskap"
    },
    {
      "period": "2014",
      "value": 508761,
      "status": "regnskap"
    },
    {
      "period": "2015",
      "value": 521589,
      "status": "regnskap"
    },
    {
      "period": "2016",
      "value": 532433,
      "status": "regnskap"
    },
    {
      "period": "2017",
      "value": 550327,
      "status": "regnskap"
    },
    {
      "period": "2018",
      "value": 572545,
      "status": "regnskap"
    },
    {
      "period": "2019",
      "value": 597198,
      "status": "regnskap"
    },
    {
      "period": "2020",
      "value": 594450,
      "status": "regnskap"
    },
    {
      "period": "2021",
      "value": 639401,
      "status": "regnskap"
    },
    {
      "period": "2022",
      "value": 708226,
      "status": "regnskap"
    },
    {
      "period": "2023",
      "value": 728606,
      "status": "regnskap"
    },
    {
      "period": "2024",
      "value": 752259,
      "status": "foreløpig"
    },
    {
      "period": "2025",
      "value": 783785,
      "status": "foreløpig"
    }
  ]
}
