{
  "id": "sysselsetting.sysselsatte_personer_na",
  "title": "Sysselsatte personer (lønnstakere og selvstendige), nasjonalregnskapet",
  "unit": "1000 personer",
  "price_basis": "ikke-relevant",
  "claim_level": "offisiell",
  "source_ids": [
    "ssb-09174"
  ],
  "vintage": "2026-05-28",
  "values": [
    {
      "period": "2000",
      "value": 2313.7,
      "status": "regnskap"
    },
    {
      "period": "2001",
      "value": 2314.9,
      "status": "regnskap"
    },
    {
      "period": "2002",
      "value": 2316.5,
      "status": "regnskap"
    },
    {
      "period": "2003",
      "value": 2282.5,
      "status": "regnskap"
    },
    {
      "period": "2004",
      "value": 2290.2,
      "status": "regnskap"
    },
    {
      "period": "2005",
      "value": 2317.3,
      "status": "regnskap"
    },
    {
      "period": "2006",
      "value": 2393.7,
      "status": "regnskap"
    },
    {
      "period": "2007",
      "value": 2488.4,
      "status": "regnskap"
    },
    {
      "period": "2008",
      "value": 2569.3,
      "status": "regnskap"
    },
    {
      "period": "2009",
      "value": 2559.1,
      "status": "regnskap"
    },
    {
      "period": "2010",
      "value": 2555.3,
      "status": "regnskap"
    },
    {
      "period": "2011",
      "value": 2592.4,
      "status": "regnskap"
    },
    {
      "period": "2012",
      "value": 2645.3,
      "status": "regnskap"
    },
    {
      "period": "2013",
      "value": 2675.6,
      "status": "regnskap"
    },
    {
      "period": "2014",
      "value": 2701.5,
      "status": "regnskap"
    },
    {
      "period": "2015",
      "value": 2712.3,
      "status": "regnskap"
    },
    {
      "period": "2016",
      "value": 2719.8,
      "status": "regnskap"
    },
    {
      "period": "2017",
      "value": 2751.4,
      "status": "regnskap"
    },
    {
      "period": "2018",
      "value": 2796.9,
      "status": "regnskap"
    },
    {
      "period": "2019",
      "value": 2841.1,
      "status": "regnskap"
    },
    {
      "period": "2020",
      "value": 2799,
      "status": "regnskap"
    },
    {
      "period": "2021",
      "value": 2829.4,
      "status": "regnskap"
    },
    {
      "period": "2022",
      "value": 2937.6,
      "status": "regnskap"
    },
    {
      "period": "2023",
      "value": 2973.3,
      "status": "regnskap"
    },
    {
      "period": "2024",
      "value": 2993,
      "status": "foreløpig"
    },
    {
      "period": "2025",
      "value": 3013.4,
      "status": "foreløpig"
    }
  ]
}
