{"id":"sysselsetting.aku_sysselsatte_feilmargin","title":"AKU: feilmargin for sysselsatte (± på 95 %-nivå)","unit":"1000 personer","price_basis":"ikke-relevant","claim_level":"offisiell","source_ids":["ssb-13618"],"values":[{"period":"2021","value":11,"status":"regnskap"},{"period":"2022","value":11,"status":"regnskap"},{"period":"2023","value":12,"status":"regnskap"},{"period":"2024","value":12,"status":"regnskap"},{"period":"2025","value":12,"status":"regnskap"}],"notes":"Feilmarginer er publisert fra 2021 (etter omleggingen); tidligere år er ikke oppgitt. Et estimat på 100 000 med feilmargin ±12 000 har et 95 %-konfidensintervall fra 88 000 til 112 000."}
