{"id":"statsbudsjett.handlingsregel_realavkastning","title":"Forventet realavkastning i Statens pensjonsfond utland (handlingsregelens rettesnor)","unit":"prosent","price_basis":"ikke-relevant","claim_level":"offisiell","source_ids":["fin-nb2027-kap3"],"values":[{"period":"2001","value":4.0},{"period":"2002","value":4.0},{"period":"2003","value":4.0},{"period":"2004","value":4.0},{"period":"2005","value":4.0},{"period":"2006","value":4.0},{"period":"2007","value":4.0},{"period":"2008","value":4.0},{"period":"2009","value":4.0},{"period":"2010","value":4.0},{"period":"2011","value":4.0},{"period":"2012","value":4.0},{"period":"2013","value":4.0},{"period":"2014","value":4.0},{"period":"2015","value":4.0},{"period":"2016","value":4.0},{"period":"2017","value":4.0},{"period":"2018","value":3.0},{"period":"2019","value":3.0},{"period":"2020","value":3.0},{"period":"2021","value":3.0},{"period":"2022","value":3.0},{"period":"2023","value":3.0},{"period":"2024","value":3.0},{"period":"2025","value":3.0},{"period":"2026","value":3.0},{"period":"2027","value":3.0}],"breaks":[{"period":"2018","note":"Rettesnoren er 3 prosent fra og med 2018 (4 prosent til og med 2017), slik kolonnene i Finansdepartementets tabell er merket.","source_id":"fin-nb2027-kap3"}]}
