{"id":"sysselsetting.ledige_register_tusen","title":"Registrerte arbeidsledige 15–74 år (Nav), registerbasert","unit":"1000 personer","price_basis":"ikke-relevant","claim_level":"utledet","derivation":"Antall personer i registerstatistikken (tabell 12423, A.09) delt på 1 000, 15–74 år, begge kjønn","source_ids":["ssb-12423"],"values":[{"period":"2015","value":71.127,"status":"regnskap"},{"period":"2016","value":65.108,"status":"regnskap"},{"period":"2017","value":53.949,"status":"regnskap"},{"period":"2018","value":51.775,"status":"regnskap"},{"period":"2019","value":48.816,"status":"regnskap"},{"period":"2020","value":78.912,"status":"regnskap"},{"period":"2021","value":47.388,"status":"regnskap"},{"period":"2022","value":35.715,"status":"regnskap"},{"period":"2023","value":41.355,"status":"regnskap"},{"period":"2024","value":46.669,"status":"regnskap"},{"period":"2025","value":49.9,"status":"foreløpig"}]}
