{
  "id": "sysselsetting.arsverk_per_sysselsatt",
  "title": "Årsverk per sysselsatt person",
  "unit": "årsverk per person",
  "price_basis": "ikke-relevant",
  "claim_level": "utledet",
  "derivation": "Årsverk (heltidsekvivalenter) delt på sysselsatte personer, begge fra nasjonalregnskapet (tabell 09174)",
  "source_ids": [
    "ssb-09174"
  ],
  "vintage": "2026-05-28",
  "values": [
    {
      "period": "2000",
      "value": 0.853,
      "status": "regnskap"
    },
    {
      "period": "2001",
      "value": 0.849,
      "status": "regnskap"
    },
    {
      "period": "2002",
      "value": 0.847,
      "status": "regnskap"
    },
    {
      "period": "2003",
      "value": 0.849,
      "status": "regnskap"
    },
    {
      "period": "2004",
      "value": 0.851,
      "status": "regnskap"
    },
    {
      "period": "2005",
      "value": 0.859,
      "status": "regnskap"
    },
    {
      "period": "2006",
      "value": 0.87,
      "status": "regnskap"
    },
    {
      "period": "2007",
      "value": 0.88,
      "status": "regnskap"
    },
    {
      "period": "2008",
      "value": 0.884,
      "status": "regnskap"
    },
    {
      "period": "2009",
      "value": 0.883,
      "status": "regnskap"
    },
    {
      "period": "2010",
      "value": 0.88,
      "status": "regnskap"
    },
    {
      "period": "2011",
      "value": 0.881,
      "status": "regnskap"
    },
    {
      "period": "2012",
      "value": 0.878,
      "status": "regnskap"
    },
    {
      "period": "2013",
      "value": 0.879,
      "status": "regnskap"
    },
    {
      "period": "2014",
      "value": 0.878,
      "status": "regnskap"
    },
    {
      "period": "2015",
      "value": 0.877,
      "status": "regnskap"
    },
    {
      "period": "2016",
      "value": 0.877,
      "status": "regnskap"
    },
    {
      "period": "2017",
      "value": 0.878,
      "status": "regnskap"
    },
    {
      "period": "2018",
      "value": 0.878,
      "status": "regnskap"
    },
    {
      "period": "2019",
      "value": 0.878,
      "status": "regnskap"
    },
    {
      "period": "2020",
      "value": 0.878,
      "status": "regnskap"
    },
    {
      "period": "2021",
      "value": 0.88,
      "status": "regnskap"
    },
    {
      "period": "2022",
      "value": 0.877,
      "status": "regnskap"
    },
    {
      "period": "2023",
      "value": 0.877,
      "status": "regnskap"
    },
    {
      "period": "2024",
      "value": 0.876,
      "status": "foreløpig"
    },
    {
      "period": "2025",
      "value": 0.875,
      "status": "foreløpig"
    }
  ]
}
