{
  "id": "staten.ansatte_staten",
  "title": "Ansatte i staten",
  "unit": "personer",
  "price_basis": "ikke-relevant",
  "claim_level": "offisiell",
  "source_ids": [
    "ssb-12623"
  ],
  "notes": "Årsgjennomsnitt (gjennomsnitt av månedene). Dekker enhetene i statsregnskapet; helseforetak og statlig eide selskaper inngår ikke. Endring i rapporteringen av arbeidstid mellom 2015 og 2016 gjør at avtalte årsverk må tolkes med forsiktighet over tid.",
  "values": [
    {
      "period": "2016",
      "value": 169305,
      "status": "regnskap"
    },
    {
      "period": "2017",
      "value": 163897,
      "status": "regnskap"
    },
    {
      "period": "2018",
      "value": 165727,
      "status": "regnskap"
    },
    {
      "period": "2019",
      "value": 166554,
      "status": "regnskap"
    },
    {
      "period": "2020",
      "value": 166483,
      "status": "regnskap"
    },
    {
      "period": "2021",
      "value": 172572,
      "status": "regnskap"
    },
    {
      "period": "2022",
      "value": 176192,
      "status": "regnskap"
    },
    {
      "period": "2023",
      "value": 176811,
      "status": "regnskap"
    },
    {
      "period": "2024",
      "value": 178019,
      "status": "regnskap"
    },
    {
      "period": "2025",
      "value": 181197,
      "status": "regnskap"
    }
  ]
}
