{"id":"staten.statsforvaltningen","title":"Sysselsatte i statsforvaltningen (inkl. helseforetak), 4. kvartal","unit":"personer","price_basis":"ikke-relevant","claim_level":"offisiell","source_ids":["ssb-13472"],"values":[{"period":"2016","value":296821,"status":"regnskap"},{"period":"2017","value":298104,"status":"regnskap"},{"period":"2018","value":300842,"status":"regnskap"},{"period":"2019","value":303774,"status":"regnskap"},{"period":"2020","value":312374,"status":"regnskap"},{"period":"2021","value":320522,"status":"regnskap"},{"period":"2022","value":325475,"status":"regnskap"},{"period":"2023","value":328891,"status":"regnskap"},{"period":"2024","value":332828,"status":"regnskap"},{"period":"2025","value":338769,"status":"regnskap"}]}
