{"id":"okonomi.handelsbalanse_i_alt","title":"Handelsbalanse (eksport minus import), alle varer og tjenester","unit":"mrd. kr","price_basis":"løpende","claim_level":"utledet","derivation":"Eksport i alt − import i alt, løpende priser (nasjonalregnskapet)","source_ids":["ssb-09189"],"vintage":"2026-05-28","values":[{"period":"1990","value":44.085,"status":"regnskap"},{"period":"1991","value":58.597,"status":"regnskap"},{"period":"1992","value":51.456,"status":"regnskap"},{"period":"1993","value":51.406,"status":"regnskap"},{"period":"1994","value":50.993,"status":"regnskap"},{"period":"1995","value":55.55,"status":"regnskap"},{"period":"1996","value":89.666,"status":"regnskap"},{"period":"1997","value":89.302,"status":"regnskap"},{"period":"1998","value":20.636,"status":"regnskap"},{"period":"1999","value":90.644,"status":"regnskap"},{"period":"2000","value":253.633,"status":"regnskap"},{"period":"2001","value":261.489,"status":"regnskap"},{"period":"2002","value":207.744,"status":"regnskap"},{"period":"2003","value":209.378,"status":"regnskap"},{"period":"2004","value":239.883,"status":"regnskap"},{"period":"2005","value":325.739,"status":"regnskap"},{"period":"2006","value":385.338,"status":"regnskap"},{"period":"2007","value":330.368,"status":"regnskap"},{"period":"2008","value":465.082,"status":"regnskap"},{"period":"2009","value":301.332,"status":"regnskap"},{"period":"2010","value":320.192,"status":"regnskap"},{"period":"2011","value":393.686,"status":"regnskap"},{"period":"2012","value":426.239,"status":"regnskap"},{"period":"2013","value":369.606,"status":"regnskap"},{"period":"2014","value":332.918,"status":"regnskap"},{"period":"2015","value":217.256,"status":"regnskap"},{"period":"2016","value":90.932,"status":"regnskap"},{"period":"2017","value":150.057,"status":"regnskap"},{"period":"2018","value":237.619,"status":"regnskap"},{"period":"2019","value":93.702,"status":"regnskap"},{"period":"2020","value":-24.281,"status":"regnskap"},{"period":"2021","value":648.025,"status":"regnskap"},{"period":"2022","value":1616.555,"status":"regnskap"},{"period":"2023","value":817.415,"status":"regnskap"},{"period":"2024","value":709.371,"status":"foreløpig"},{"period":"2025","value":650.399,"status":"foreløpig"}]}
