{
  "id": "sysselsetting.sysselsatte_register_tusen",
  "title": "Sysselsatte 15–74 år, registerbasert",
  "unit": "1000 personer",
  "price_basis": "ikke-relevant",
  "claim_level": "utledet",
  "derivation": "Antall personer i registerstatistikken (tabell 12423, A.01) delt på 1 000, 15–74 år, begge kjønn",
  "source_ids": [
    "ssb-12423"
  ],
  "values": [
    {
      "period": "2015",
      "value": 2602.161,
      "status": "regnskap"
    },
    {
      "period": "2016",
      "value": 2616.897,
      "status": "regnskap"
    },
    {
      "period": "2017",
      "value": 2650.019,
      "status": "regnskap"
    },
    {
      "period": "2018",
      "value": 2685.365,
      "status": "regnskap"
    },
    {
      "period": "2019",
      "value": 2714.069,
      "status": "regnskap"
    },
    {
      "period": "2020",
      "value": 2683.277,
      "status": "regnskap"
    },
    {
      "period": "2021",
      "value": 2766.907,
      "status": "regnskap"
    },
    {
      "period": "2022",
      "value": 2824.393,
      "status": "regnskap"
    },
    {
      "period": "2023",
      "value": 2849.089,
      "status": "regnskap"
    },
    {
      "period": "2024",
      "value": 2865.634,
      "status": "regnskap"
    },
    {
      "period": "2025",
      "value": 2872.856,
      "status": "foreløpig"
    }
  ]
}
