{"id":"statsbudsjett.netto_utlan_regnskap","title":"Netto utlån mv. (regnskap)","unit":"mrd. kr","price_basis":"løpende","claim_level":"offisiell","source_ids":["ssb-10486"],"vintage":"2026-06-09","values":[{"period":"2000","value":1.931,"status":"regnskap"},{"period":"2001","value":18.266,"status":"regnskap"},{"period":"2002","value":33.165,"status":"regnskap"},{"period":"2003","value":8.225,"status":"regnskap"},{"period":"2004","value":-6.992,"status":"regnskap"},{"period":"2005","value":7.322,"status":"regnskap"},{"period":"2006","value":-79.861,"status":"regnskap"},{"period":"2007","value":31.245,"status":"regnskap"},{"period":"2008","value":22.171,"status":"regnskap"},{"period":"2009","value":142.038,"status":"regnskap"},{"period":"2010","value":43.29,"status":"regnskap"},{"period":"2011","value":22.231,"status":"regnskap"},{"period":"2012","value":-27.098,"status":"regnskap"},{"period":"2013","value":70.431,"status":"regnskap"},{"period":"2014","value":-39.391,"status":"regnskap"},{"period":"2015","value":36.153,"status":"regnskap"},{"period":"2016","value":37.589,"status":"regnskap"},{"period":"2017","value":-7.503,"status":"regnskap"},{"period":"2018","value":-100.019,"status":"regnskap"},{"period":"2019","value":8.036,"status":"regnskap"},{"period":"2020","value":51.918,"status":"regnskap"},{"period":"2021","value":9.353,"status":"regnskap"},{"period":"2022","value":91.856,"status":"regnskap"},{"period":"2023","value":-81.845,"status":"regnskap"},{"period":"2024","value":57.788,"status":"regnskap"},{"period":"2025","value":68.627,"status":"regnskap"}]}
