{
  "id": "test.utledet_andel",
  "title": "SYNTETISK: Utledet andel",
  "unit": "prosent",
  "price_basis": "ikke-relevant",
  "claim_level": "utledet",
  "derivation": "test.bnp(t) / 1,2",
  "source_ids": [
    "test-kilde-a"
  ],
  "values": [
    {
      "period": "2023",
      "value": 93.3
    },
    {
      "period": "2024",
      "value": 98.8
    }
  ]
}
